,Title,URL,Views,Votes
21,C# 9 - How to call default interface method with reflection?,/questions/66564549/c-sharp-9-how-to-call-default-interface-method-with-reflection,41,4
47,How do I solve this error of 'not all code paths return a value'?,/questions/66563677/how-do-i-solve-this-error-of-not-all-code-paths-return-a-value,38,0
38,Update a null column in sql with spexecutesql,/questions/66564067/update-a-null-column-in-sql-with-spexecutesql,36,0
13,How can I store linq queries?,/questions/66564852/how-can-i-store-linq-queries,36,2
36,Time validations in c#,/questions/66564172/time-validations-in-c-sharp,35,1
49,Optional/Default parameter and params in method argument error,/questions/66563543/optional-default-parameter-and-params-in-method-argument-error,26,0
37,C#: Can't include class from annother namespace [duplicate],/questions/66564098/c-cant-include-class-from-annother-namespace,24,0
19,How can I avoid CORS error when multiple awaits are used in the webapi controller?,/questions/66564612/how-can-i-avoid-cors-error-when-multiple-awaits-are-used-in-the-webapi-controlle,23,-3
10,"How do I check if an int is divisible by another int? Using c#, Following specified the conditions",/questions/66565052/how-do-i-check-if-an-int-is-divisible-by-another-int-using-c-following-specif,23,-1
11,ASP.NET Core MVC controller receives null for input parameter from ajax call,/questions/66564866/asp-net-core-mvc-controller-receives-null-for-input-parameter-from-ajax-call,23,2
34,C# - Byte array from SecureString,/questions/66564204/c-sharp-byte-array-from-securestring,21,0
22,DB2 C# Date Conversion,/questions/66564511/db2-c-sharp-date-conversion,20,1
35,File does not convert Image format in asp.net core,/questions/66564201/file-does-not-convert-image-format-in-asp-net-core,19,0
33,Get CheckBox Content with Databinding in C# ListView Checkbox,/questions/66564247/get-checkbox-content-with-databinding-in-c-sharp-listview-checkbox,18,0
17,Moving Player 'X' from text file in C#,/questions/66564736/moving-player-x-from-text-file-in-c-sharp,17,0
14,SqlException: 'SCOPE_INDENTITY' is not a recognized built-in function name [closed],/questions/66564821/sqlexception-scope-indentity-is-not-a-recognized-built-in-function-name,15,0
18,Xamarin.Forms would not compile Android Project,/questions/66564661/xamarin-forms-would-not-compile-android-project,14,0
9,How to set style of some parts of text in DataGrid by condition in C#,/questions/66565073/how-to-set-style-of-some-parts-of-text-in-datagrid-by-condition-in-c-sharp,14,0
30,Rest API post call with token & multipartform returns 401 error,/questions/66564314/rest-api-post-call-with-token-multipartform-returns-401-error,14,0
28,Relashionship configuration of multiple navigation properties of same type?,/questions/66564383/relashionship-configuration-of-multiple-navigation-properties-of-same-type,13,0
23,Printint multiple pdf pages on per page with C#,/questions/66564505/printint-multiple-pdf-pages-on-per-page-with-c-sharp,13,0
48,Timer in Unity? [duplicate],/questions/66563578/timer-in-unity,13,-1
26,Timer (C#) does not tick when native code debugging is enabled,/questions/66564445/timer-c-does-not-tick-when-native-code-debugging-is-enabled,13,0
39,SSIS C# Debugging and Breakpoints not working with Integration Services Object,/questions/66564021/ssis-c-sharp-debugging-and-breakpoints-not-working-with-integration-services-obj,12,0
27,I want to use IHttpClientFactory with Prism,/questions/66564435/i-want-to-use-ihttpclientfactory-with-prism,12,1
12,How to set an existing key in the registry editor using C sharp,/questions/66564865/how-to-set-an-existing-key-in-the-registry-editor-using-c-sharp,11,0
40,Debugging Native C++ from C# project peformance,/questions/66563982/debugging-native-c-from-c-sharp-project-peformance,11,0
42,Get Content or Name from WPF Label when clicking using MouseLeftButtonUp [duplicate],/questions/66563929/get-content-or-name-from-wpf-label-when-clicking-using-mouseleftbuttonup,11,0
25,How to create MaterialSingleLineTextField dynamically in windows forms,/questions/66564456/how-to-create-materialsinglelinetextfield-dynamically-in-windows-forms,10,2
20,Listview row colour with no subitems not changing colour correctly,/questions/66564567/listview-row-colour-with-no-subitems-not-changing-colour-correctly,10,0
1,Is it possible to write the expression with with async and Null-conditional operators ?. briefly?,/questions/66565467/is-it-possible-to-write-the-expression-with-with-async-and-null-conditional-oper,10,0
6,issue with spawning multiples of the same snake food,/questions/66565289/issue-with-spawning-multiples-of-the-same-snake-food,9,2
3,Ignore Null value in order by with linq,/questions/66565394/ignore-null-value-in-order-by-with-linq,9,0
7,"When i try to rename files, i encountered an error about the File.Move method",/questions/66565285/when-i-try-to-rename-files-i-encountered-an-error-about-the-file-move-method,9,0
43,How to activate the inactived parent window in WPF,/questions/66563917/how-to-activate-the-inactived-parent-window-in-wpf,9,0
44,Unable to load dll 'SQLite.interop.dll' after installing my app. The dll is present and installing Visual Studio mysteriously fixes it,/questions/66563854/unable-to-load-dll-sqlite-interop-dll-after-installing-my-app-the-dll-is-pres,8,0
8,New models present after upgrading Swashbuckle.AspNetCore 6.0.1,/questions/66565253/new-models-present-after-upgrading-swashbuckle-aspnetcore-6-0-1,8,1
45,Bridge to Kubernetes Not Working With Grpc Service,/questions/66563776/bridge-to-kubernetes-not-working-with-grpc-service,7,0
16,C#.NET WinForms: Connect to oracle cloud db via server,/questions/66564804/c-net-winforms-connect-to-oracle-cloud-db-via-server,7,0
15,How to block download for SharePoint in CSOM,/questions/66564819/how-to-block-download-for-sharepoint-in-csom,7,0
4,Hours Watched Twitch API,/questions/66565345/hours-watched-twitch-api,6,0
0,Code returns“The Name 'noiseMap' does not exist in current context”,/questions/66565479/code-returnsthe-name-noisemap-does-not-exist-in-current-context,6,0
24,Writing additional bytes to picture c#,/questions/66564462/writing-additional-bytes-to-picture-c-sharp,6,0
31,Xamarin.Forms Cell Rendering Error after updating to Android 10,/questions/66564302/xamarin-forms-cell-rendering-error-after-updating-to-android-10,6,0
41,TelemetryClient.Flush not being called with Autofac,/questions/66563975/telemetryclient-flush-not-being-called-with-autofac,5,0
32,ASP.NET Core Runtime Compilation fails with “Cannot find compilation library location for package” for dynamically loaded Razor Class Library,/questions/66564269/asp-net-core-runtime-compilation-fails-with-cannot-find-compilation-library-loc,5,0
46,C# MVC Owin.Security.Keycloak CORS when Controller and Action called by Javascriptcode,/questions/66563736/c-sharp-mvc-owin-security-keycloak-cors-when-controller-and-action-called-by-jav,5,0
29,Variable size of exported OxyPlot graph based on size of legend,/questions/66564356/variable-size-of-exported-oxyplot-graph-based-on-size-of-legend,5,0
5,Bittrex API V3 invalid API key,/questions/66565295/bittrex-api-v3-invalid-api-key,4,0
2,ASP.NET Core3.1 responsive image,/questions/66565420/asp-net-core3-1-responsive-image,4,0
