,Title,URL,Views,Votes
48,i'm having problem extracting string values through regex,/questions/66564961/im-having-problem-extracting-string-values-through-regex,32,0
36,How to return enum in the DTO?,/questions/66565191/how-to-return-enum-in-the-dto,28,0
25,Accessing Instance Variable on Another Method Java,/questions/66565365/accessing-instance-variable-on-another-method-java,26,-1
2,This is a Java function I am stuck a bit [closed],/questions/66566014/this-is-a-java-function-i-am-stuck-a-bit,22,-2
22,Why do I see unknown source in stack traces when I have sources downloaded?,/questions/66565398/why-do-i-see-unknown-source-in-stack-traces-when-i-have-sources-downloaded,22,0
40,Implementing CrudeRepository with an interface and Long,/questions/66565137/implementing-cruderepository-with-an-interface-and-long,21,0
41,How do you make a function that subtracts 2 values but will make value “a” not go beneath 0?,/questions/66565136/how-do-you-make-a-function-that-subtracts-2-values-but-will-make-value-a-not-g,21,-3
5,How to map generic list into another generic list?,/questions/66565851/how-to-map-generic-list-into-another-generic-list,20,0
44,The purpose of children duplicates prohibition,/questions/66565022/the-purpose-of-children-duplicates-prohibition,17,-2
29,"Adding a whitespace inside a List of strings, java?",/questions/66565339/adding-a-whitespace-inside-a-list-of-strings-java,17,0
42,how to invoke a method in JSP (Spring MVC),/questions/66565072/how-to-invoke-a-method-in-jsp-spring-mvc,17,0
11,How to work with Prepared Statements in Java?,/questions/66565717/how-to-work-with-prepared-statements-in-java,17,0
31,How to disable whitelabel error page in application.yaml (spring boot),/questions/66565233/how-to-disable-whitelabel-error-page-in-application-yaml-spring-boot,16,0
16,Excel XML to Java Object,/questions/66565549/excel-xml-to-java-object,15,-1
26,Index 3 out of bounds for length 0 When trying to set a Student object to a Laboratory Array(java),/questions/66565361/index-3-out-of-bounds-for-length-0-when-trying-to-set-a-student-object-to-a-labo,15,-2
27,How to convert LocalDateTime back to Instant without knowing timezone but with Clock?,/questions/66565352/how-to-convert-localdatetime-back-to-instant-without-knowing-timezone-but-with-c,15,0
18,Replace Java with/ or add OpenWebStart on 2012 R2 Windows Server [closed],/questions/66565464/replace-java-with-or-add-openwebstart-on-2012-r2-windows-server,14,-8
23,how to find files that neve opend before?,/questions/66565385/how-to-find-files-that-neve-opend-before,14,0
4,How to check if file exist after build jlink?,/questions/66565855/how-to-check-if-file-exist-after-build-jlink,13,1
46,spring framework classreader exception,/questions/66564985/spring-framework-classreader-exception,12,0
32,How to run a java project of Stanford Open Information Extraction? [closed],/questions/66565223/how-to-run-a-java-project-of-stanford-open-information-extraction,12,-4
39,Android 9 and above webview scroll is not working like android 8,/questions/66565143/android-9-and-above-webview-scroll-is-not-working-like-android-8,12,0
20,Multiple database connection reusing entity mapping,/questions/66565452/multiple-database-connection-reusing-entity-mapping,12,0
21,how to get data from json object inside json array [duplicate],/questions/66565436/how-to-get-data-from-json-object-inside-json-array,12,-6
9,Android app How do I request an Internet connection from a user? [closed],/questions/66565761/android-app-how-do-i-request-an-internet-connection-from-a-user,12,-4
37,How can I choose between two jars in a different librarys?,/questions/66565189/how-can-i-choose-between-two-jars-in-a-different-librarys,12,1
10,How do I make a file in java.io.file?,/questions/66565754/how-do-i-make-a-file-in-java-io-file,11,0
47,Where can I add javax.media.jai Jar package in Java?,/questions/66564983/where-can-i-add-javax-media-jai-jar-package-in-java,10,0
35,Is it possiblet to change Header data dynamically in HTTP header,/questions/66565196/is-it-possiblet-to-change-header-data-dynamically-in-http-header,10,-1
19,search by maximum value in MongoDB,/questions/66565459/search-by-maximum-value-in-mongodb,10,1
7,Spring Data Jpa to get data which doesn't have entity representation,/questions/66565764/spring-data-jpa-to-get-data-which-doesnt-have-entity-representation,10,0
33,Spring Boot: Use Views from a MySQL database,/questions/66565198/spring-boot-use-views-from-a-mysql-database,9,0
49,Can't upload mediaRecorder file on firebase storage,/questions/66564913/cant-upload-mediarecorder-file-on-firebase-storage,9,0
14,How to create Dynamic JNDI datasources on startup for ADF application running in Tomcat 9.x,/questions/66565610/how-to-create-dynamic-jndi-datasources-on-startup-for-adf-application-running-in,8,0
15,Add Font Awesome font in jasper report using JAVA,/questions/66565589/add-font-awesome-font-in-jasper-report-using-java,8,-3
43,"Java Process API waitFor() method returns “1” OR negative integer(inconsistent) value, hangs sometime",/questions/66565058/java-process-api-waitfor-method-returns-1-or-negative-integerinconsistent,8,0
6,"Print to console & email all failed jobs, pipelines, and multibranch pipelines within the last 24 hours",/questions/66565798/print-to-console-email-all-failed-jobs-pipelines-and-multibranch-pipelines-w,7,0
1,Android Studio github library implementation,/questions/66566056/android-studio-github-library-implementation,7,0
24,How is this injection happening in spring [duplicate],/questions/66565369/how-is-this-injection-happening-in-spring,7,0
34,Install Failed Missing Shared Library,/questions/66565197/install-failed-missing-shared-library,7,0
45,How to add libgdx google play service? Step by step please,/questions/66565008/how-to-add-libgdx-google-play-service-step-by-step-please,7,-2
8,How to hide or disable the address bar on Edge?,/questions/66565763/how-to-hide-or-disable-the-address-bar-on-edge,7,0
13,Return Last Message in Flutter,/questions/66565618/return-last-message-in-flutter,6,-1
28,Java Multiplication Table Formatting,/questions/66565349/java-multiplication-table-formatting,5,0
38,How to join OneToMany in Spring boot JPA with a complex Where condition?,/questions/66565176/how-to-join-onetomany-in-spring-boot-jpa-with-a-complex-where-condition,5,0
17,Servlet.service() for servlet [dispatcherServlet] in context with path [] threw exception […] with root cause [duplicate],/questions/66565533/servlet-service-for-servlet-dispatcherservlet-in-context-with-path-threw,5,0
12,Unable to obtain inputstream for resource. Flyway and gradle,/questions/66565674/unable-to-obtain-inputstream-for-resource-flyway-and-gradle,5,0
30,Rawquery to some tables always returns empty cursor,/questions/66565307/rawquery-to-some-tables-always-returns-empty-cursor,4,0
3,Authentication with firebase with java desktop,/questions/66566009/authentication-with-firebase-with-java-desktop,3,0
0,How to suppress check-style warning in Kotlin,/questions/66566111/how-to-suppress-check-style-warning-in-kotlin,2,0
